{
  "$comment": "SPDX-License-Identifier: MIT",
  "$schema": "../schemas/change-evidence.schema.json",
  "schema_version": "1.1",
  "change_id": "ERGON-CHANGE-0036",
  "stage": "optional-indexing",
  "status": "under-review",
  "record_path": "docs/engineering/changes/ergon-change-0036.json",
  "purpose": {
    "summary": "Add a persistent, reversible Chronik token-index runtime core for accepted ALP and SLP transaction streams while keeping the runtime unlinked from the node and outside every consensus decision.",
    "scope": [
      "Introduce the independently authored chronik-runtime crate over the donor-bound Chronik database, transaction and ALP/SLP verification primitives accepted in ERGON-CHANGE-0035.",
      "Atomically persist accepted block identity, ordered transaction reverse lookups, token ancestry, token metadata and genesis payloads, then reconstruct the indexed tip after restart.",
      "Require exact height and parent continuity on connect and exact tip identity plus ordered transaction identity on disconnect.",
      "Exercise ALP genesis, mint, send and burn persistence, restart, exact-tip rollback, ordering contradictions and failed-validation atomicity.",
      "Include the runtime in the default-off locked Rust build and CI corpus while preserving the existing node-independent build graph."
    ],
    "exclusions": [
      "No node callback, startup option, datadir binding, block-file reader, mempool hook, HTTP, gRPC, websocket or public query API is added.",
      "No consensus, validation, activation, chain-selection, wallet, P2P, network identity or mainnet parameter change is included.",
      "No private history, private source, operator data, incoming report, binary, build output or host-specific path is tracked."
    ]
  },
  "baseline": {
    "project": "Bitcoin Static",
    "version": "24.0.5",
    "commit": "2e8d5f7635c899cc99e71f06dedbe72b3ff7f07b",
    "tree": "8a74bb952c2137156214b9fe5888c494bd77aeca",
    "license": "MIT"
  },
  "public_lineage": {
    "public_root": {
      "commit": "5bcdba149119aa9035830e069d1cae1d9bcddfb4",
      "tree": "8a74bb952c2137156214b9fe5888c494bd77aeca",
      "parentless": true
    },
    "integration_parent": {
      "commit": "87ec12990966c5dd1e6023f7bde1771700bc4813",
      "tree": "2ce830739a8594952fe9354ca2236b0d4215a804"
    },
    "candidate_parent_law": "direct-child",
    "remote_ref": "refs/remotes/origin/main"
  },
  "signature_policy": {
    "format": "ssh",
    "key_algorithm": "ED25519",
    "principal": "153525861+ErgonSurfer@users.noreply.github.com",
    "fingerprint": "SHA256:kC/Vx9WJW9ufy4Ttg5tKK6Cw8jEuV9ej2mRCLvZyU3Q",
    "public_key": "ssh-ed25519 AAAAC3NzaC1lZDI1NTE5AAAAIFN47Qs8VW9ty+v0tf31kv6pMpyOMxWWLXZ0Pv5MWVCI Ergon Lab Git commit signing (ErgonSurfer)",
    "public_key_bytes": 124,
    "public_key_sha256": "0ef0d6055bf86ace992821a029055ed3d3e2da2047619627d3f8405c6cad7512",
    "allowed_signers_bytes": 128,
    "allowed_signers_sha256": "4df5711122f5777dbaea2480d2d1fdef81ea294a79d835ab0173ae0065dfa738",
    "candidate_same_key": true
  },
  "provenance_inventory": {
    "inventory_schema": "ergon-authorship-inventory/v1",
    "inventory_sha256": "ff61ec0db0785e2b2ba35b288e64924408862c0f1e4205b392b57f3fce425ff6",
    "license": "MIT",
    "standing_policy": "PUBLICATION_POLICY.md",
    "exclusions": [
      "Unattributed donor code is excluded.",
      "Private history, operator material, host metadata and unrelated private product material are excluded."
    ],
    "implicit_operational_authorization": false
  },
  "prerequisites": [
    {
      "change_id": "ERGON-CHANGE-0015",
      "stage": "legacy-compatibility",
      "public_commit": "ef989b4fa55098f55e7a78f0682cf2f60319b921",
      "evidence_sha256": "6b6eafa29b74c1ff0824d77051b8eb47f0078cfe05e2e33f716ac17eb963f647",
      "delivery_state": "verified",
      "knowledge_status": "Reproduced"
    }
  ],
  "files": [
    {
      "path": ".github/workflows/chronik-port-core.yml",
      "action": "modify",
      "role": "build",
      "before": {
        "mode": "100644",
        "bytes": 2154,
        "git_blob": "cc4eda9b630d3fd067111e3792a1cc1dca6727b4",
        "sha256": "3fc5b66e9622623c270c5fe8a9ab6419162034edb1ce0ee29356fb2708236650"
      },
      "after": {
        "mode": "100644",
        "bytes": 2163,
        "git_blob": "c88ad9b5a7ca1b625620cdacfdbade4a7b2d5593",
        "sha256": "94f9a7243f9a9ffe408fdb4de30e0c7c52bc2593db7834322382efb4ab5e78eb"
      },
      "provenance": {
        "kind": "independent-authorship",
        "code": "BASE+A1",
        "license": "MIT"
      },
      "spdx": "MIT",
      "production_reachability": "Build and CI graph only; BUILD_CHRONIK_PORT_CORE remains default OFF and no node link edge is added.",
      "test_reachability": "Runs the locked donor corpus plus persistent runtime tests under Rust 1.85.0."
    },
    {
      "path": "CMakeLists.txt",
      "action": "modify",
      "role": "build",
      "before": {
        "mode": "100644",
        "bytes": 3890,
        "git_blob": "d3ce75226d851e7f2d2be95d4af2bee7037874bd",
        "sha256": "02f905543d0086d2abb7ced1c0b065e2fcee8ce0ed2cf2c028dc93bda51a909d"
      },
      "after": {
        "mode": "100644",
        "bytes": 3897,
        "git_blob": "297de58f917b6b82eb7a79e4c9f7165033804c70",
        "sha256": "979fba10b99db572912c496aecb6f69c0fa5d6b4d4afa4bc4ae0997db4133840"
      },
      "provenance": {
        "kind": "independent-authorship",
        "code": "BASE+A1",
        "license": "MIT"
      },
      "spdx": "MIT",
      "production_reachability": "Build description only; the default-off switch remains unchanged.",
      "test_reachability": "Describes the persistent runtime now covered by the port-core target."
    },
    {
      "path": "chronik/CMakeLists.txt",
      "action": "modify",
      "role": "build",
      "before": {
        "mode": "100644",
        "bytes": 5522,
        "git_blob": "354f614cb2a267461990aea8e126ba538d61085c",
        "sha256": "a169078ae8ac7b2dab0577c8c3561fa3b9a8a260abd3db2788af5a82dcf97d90"
      },
      "after": {
        "mode": "100644",
        "bytes": 5552,
        "git_blob": "2766db39e525e734e2fcf6b88d13550b33d7bf63",
        "sha256": "1c7505b0a5dbe9e356b4e05233a93d7b3e6179ee9893f3878be7c4996ae2bd10"
      },
      "provenance": {
        "kind": "independent-authorship",
        "code": "BASE+A1",
        "license": "MIT"
      },
      "spdx": "MIT",
      "production_reachability": "Default-off Rust build target only; no C++ node target consumes the runtime.",
      "test_reachability": "Adds chronik-runtime to the governed package list."
    },
    {
      "path": "chronik/Cargo.lock",
      "action": "modify",
      "role": "build",
      "before": {
        "mode": "100644",
        "bytes": 37797,
        "git_blob": "d432f1ed969cc02eede14581405a6a9c07c278a0",
        "sha256": "7af496d774c6180ed13a935b8c8080b0394fe5720697231aabbcc0b2cfaaf689"
      },
      "after": {
        "mode": "100644",
        "bytes": 37975,
        "git_blob": "cb525946a44994088ff8739b4a1cca90f8730bfa",
        "sha256": "4cf83a615f394890a749abe5bddf973a07bb779026b25110a31f48c4cb617a17"
      },
      "provenance": {
        "kind": "independent-authorship",
        "code": "BASE+A1-GENERATED",
        "license": "MIT"
      },
      "spdx": "MIT",
      "production_reachability": "Locked build input for the default-off Chronik port-core workspace.",
      "test_reachability": "Binds the local runtime package without widening the external dependency closure."
    },
    {
      "path": "chronik/Cargo.toml",
      "action": "modify",
      "role": "build",
      "before": {
        "mode": "100644",
        "bytes": 621,
        "git_blob": "ccc2ca568ad2f924e936875e8805f7c467c32795",
        "sha256": "29ad05fcaa8d3605d8c85c18c8140f7d0e8f70f87407d0dba2212381b28bbc78"
      },
      "after": {
        "mode": "100644",
        "bytes": 667,
        "git_blob": "3f6d74df97dd36ae0c7eba4492fcc4655e753452",
        "sha256": "328ba0a85058124187563effc88560663ebdc34df781b12965e325b014ac858f"
      },
      "provenance": {
        "kind": "independent-authorship",
        "code": "BASE+A1",
        "license": "MIT"
      },
      "spdx": "MIT",
      "production_reachability": "Workspace construction only; no standalone-node link edge.",
      "test_reachability": "Makes chronik-runtime a governed default workspace member."
    },
    {
      "path": "chronik/README.md",
      "action": "modify",
      "role": "documentation",
      "before": {
        "mode": "100644",
        "bytes": 11717,
        "git_blob": "6dbed12675838125a547823ca233e813f1d7f36d",
        "sha256": "dd320a6f0661201f388ed004340cb055f41189ef6e9db5bf2a396fcde3a05578"
      },
      "after": {
        "mode": "100644",
        "bytes": 12778,
        "git_blob": "9994577ffd055c2c4b2cb4b8f5c561470ddd1454",
        "sha256": "9b412913b58529a00f44af1c1269ea1201af8f6709c2e5388d85b6e4400b81a6"
      },
      "provenance": {
        "kind": "independent-authorship",
        "code": "BASE+A1",
        "license": "MIT"
      },
      "spdx": "MIT",
      "production_reachability": "None; public boundary and architecture documentation.",
      "test_reachability": "Reviewed by the publication and provenance gates."
    },
    {
      "path": "chronik/chronik-runtime/Cargo.toml",
      "action": "add",
      "role": "build",
      "before": null,
      "after": {
        "mode": "100644",
        "bytes": 456,
        "git_blob": "34f17b1135c070de8a074d77a49f86c7353c08d7",
        "sha256": "db36853779b895d09d7f65fba98797f9f8fb95c3f3c64538b0ea48e247ed2b76"
      },
      "provenance": {
        "kind": "independent-authorship",
        "code": "A1",
        "license": "MIT"
      },
      "spdx": "MIT",
      "production_reachability": "Default-off Rust workspace descriptor; not linked into bitcoind.",